{
  "$schema": "../schemas/approval.schema.json",
  "baseRecords": [
    {
      "path": "oracles/functional/particle-emitter/canvas.json",
      "sha256": "df322974b00400e656c64a4c45b32103604d32d280a74a3c112289f817b95ec6"
    },
    {
      "path": "oracles/functional/particle-emitter/webgl.json",
      "sha256": "7f3f8e5a803f92fd8a7169d6617847683096d0adac43cf2c05b7cb648c712db4"
    },
    {
      "path": "oracles/functional/particle-emitter/webgpu.json",
      "sha256": "53b63118287c14084932105dd68db7167648da050be724ce093005200330138d"
    }
  ],
  "candidateSha256": "ee8f6047ff7446c601302253f88ff7ceb31d7a52e0f3fe7cfb32624e787bea91",
  "flightCommit": "2ab4a06667b0db0751b848e22fd7999f391b29b2",
  "preparedArtifact": {
    "artifactId": 10329323260,
    "digest": "sha256:cb337ad32f73a688bf90745c57da6899e4afc056de5922cf421e5e2bd3b1b21c",
    "repository": "flighthq/flight-reference-images",
    "workflowRunId": 34795274347
  },
  "records": [
    {
      "path": "oracles/functional/particle-emitter/canvas.json",
      "sha256": "c6fdf495fad001fd0c7a374622b6e2fa997b5d46bf1bf0113910f8b9b64f8ef1"
    },
    {
      "path": "oracles/functional/particle-emitter/webgl.json",
      "sha256": "b96ab92b165b132f30fc1e08e5a6348b2871fc64ad7e0a259de4701cacaef498"
    },
    {
      "path": "oracles/functional/particle-emitter/webgpu.json",
      "sha256": "9fe50b26c3645d92d14f75ccac5268b97c83950382fc0d241ad9cfa702aae7b0"
    }
  ],
  "requestId": "954c2738-287e-4a9e-9280-c535e6dc1a32",
  "requestSha256": "9aac3f7625f49cacbc4772ad709b95ca33270569f072a4aa818170deda3d3997",
  "schemaVersion": 1,
  "sourceArtifact": {
    "artifactId": 10327258862,
    "digest": "sha256:0903171d7d298867d633d1379681901240e51ff333c409f721c20418af0b95f9",
    "repository": "flighthq/flight",
    "workflowRunId": 34788510597
  }
}
